{
  "schema_version": 1,
  "program_id": "ai-factory-self-enhancement-v1",
  "request_key": "self-enhancement-2026-10-03",
  "project_id": "ai-factory",
  "repository_id": "ai-factory",
  "intent": "self_enhancement",
  "scope_verb": "implement",
  "base_revision": "30c46dd3056abecdcaddc8acc8a8bff573a2d2df",
  "spec_path": "docs/superpowers/specs/2026-10-03-self-enhancement-lifecycle-design.md",
  "plan_path": "docs/superpowers/plans/2026-10-03-v1-self-enhancement-lifecycle.md",
  "authorization": {
    "allowed_paths": [
      "AGENTS.md",
      "autonomy/",
      "docs/",
      "milestone1/",
      "milestone2/",
      "milestone3/",
      "milestone4/",
      "tests/"
    ],
    "allowed_actions": [
      "repo.read",
      "repo.write",
      "git.read",
      "git.diff.read",
      "validation.run",
      "knowledge.search",
      "memory.search",
      "artifact.write"
    ],
    "remote_actions": [],
    "max_correction_rounds": 3,
    "expires_at": "2026-12-31T23:59:59Z"
  },
  "waves": [
    {
      "id": "orchestration",
      "size": "large",
      "risk": "normal",
      "change_type": "code",
      "required_capabilities": [
        "repo.read",
        "repo.write",
        "git.read",
        "git.diff.read",
        "validation.run",
        "artifact.write"
      ],
      "optional_capabilities": [],
      "context_budget": {
        "max_bytes": 48000,
        "max_tokens": 12000
      },
      "verification_profile": "ai-factory-full",
      "knowledge_impact": "update",
      "blocked_by": []
    },
    {
      "id": "context-knowledge",
      "size": "large",
      "risk": "normal",
      "change_type": "code",
      "required_capabilities": [
        "repo.read",
        "repo.write",
        "git.read",
        "validation.run",
        "knowledge.search",
        "artifact.write"
      ],
      "optional_capabilities": [
        "memory.search"
      ],
      "context_budget": {
        "max_bytes": 48000,
        "max_tokens": 12000
      },
      "verification_profile": "ai-factory-full",
      "knowledge_impact": "update",
      "blocked_by": [
        "orchestration"
      ]
    },
    {
      "id": "verification-delivery",
      "size": "large",
      "risk": "high",
      "change_type": "code",
      "required_capabilities": [
        "repo.read",
        "repo.write",
        "git.read",
        "git.diff.read",
        "validation.run",
        "artifact.write"
      ],
      "optional_capabilities": [],
      "context_budget": {
        "max_bytes": 40000,
        "max_tokens": 10000
      },
      "verification_profile": "ai-factory-full",
      "knowledge_impact": "update",
      "blocked_by": [
        "context-knowledge"
      ]
    },
    {
      "id": "continuous-operation",
      "size": "large",
      "risk": "high",
      "change_type": "mixed",
      "required_capabilities": [
        "repo.read",
        "repo.write",
        "git.read",
        "git.diff.read",
        "validation.run",
        "artifact.write"
      ],
      "optional_capabilities": [
        "knowledge.search",
        "memory.search"
      ],
      "context_budget": {
        "max_bytes": 40000,
        "max_tokens": 10000
      },
      "verification_profile": "ai-factory-full",
      "knowledge_impact": "update",
      "blocked_by": [
        "verification-delivery"
      ]
    }
  ]
}
